{
  "$schema": "http://json-schema.org/draft-07/schema#",
  "title": "Dev Resource Category File",
  "description": "Schema for a single category file under data/categories/*.json",
  "type": "object",
  "required": ["category", "slug", "description", "entries"],
  "properties": {
    "category": {
      "type": "string",
      "description": "Human-readable category name, e.g. 'Source Code Hosting'"
    },
    "slug": {
      "type": "string",
      "description": "URL/anchor-safe id for the category, e.g. 'source-code-hosting'"
    },
    "description": {
      "type": "string",
      "description": "One or two sentence summary of what this category covers"
    },
    "entries": {
      "type": "array",
      "items": {
        "type": "object",
        "required": ["name", "url", "pricingModel", "summary", "freeTier", "tags", "lastVerified"],
        "properties": {
          "name": { "type": "string", "description": "Product / service name" },
          "url": { "type": "string", "format": "uri" },
          "pricingModel": {
            "type": "string",
            "enum": ["free", "freemium", "free-trial", "open-source", "paid"],
            "description": "free = entirely free product. freemium = perpetual free tier + paid upgrade. free-trial = time-boxed trial only, no perpetual free tier. open-source = free/self-hostable OSS, may have a paid hosted option. paid = no meaningful free tier, included as a notable paid utility for comparison."
          },
          "summary": {
            "type": "string",
            "description": "1-3 sentence description of what the product does"
          },
          "freeTier": {
            "type": "string",
            "description": "Specific, concrete limits of the free offering (quota, seats, storage, requests/month, duration). Use 'N/A' if pricingModel is 'paid'."
          },
          "paidFrom": {
            "type": "string",
            "description": "Entry-level paid plan price/limits, if known. Optional."
          },
          "tags": {
            "type": "array",
            "items": { "type": "string" },
            "description": "Lowercase keywords for search/filter, e.g. ['ci-cd','containers','self-hosted']"
          },
          "notes": {
            "type": "string",
            "description": "Optional caveats, gotchas, or standout details (rate-limit resets, regional restrictions, sign-up requirements like credit card)"
          },
          "alternativeTo": {
            "type": "string",
            "description": "Optional: well-known paid product this is commonly compared to"
          },
          "lastVerified": {
            "type": "string",
            "format": "date",
            "description": "YYYY-MM-DD date this entry's pricing/limits were last checked"
          }
        }
      }
    }
  }
}
