{
  "category": "AI, LLMs & ML Platforms",
  "slug": "ai-llm",
  "description": "LLM API providers, AI coding assistants, ML experiment tracking, and notebook/GPU compute for machine learning.",
  "entries": [
    {
      "name": "Anthropic Claude API",
      "url": "https://www.anthropic.com/api",
      "pricingModel": "freemium",
      "summary": "Access to the Claude family of models for chat, coding, and agentic tasks via API, console, and SDKs.",
      "freeTier": "New accounts get limited starter credits; no perpetual free API tier — usage billed per-token after credits.",
      "paidFrom": "Pay-as-you-go per-token pricing varies by model tier.",
      "tags": ["llm", "api", "ai"],
      "notes": "Free chat usage is available at claude.ai separately from the metered developer API.",
      "lastVerified": "2026-06-01"
    },
    {
      "name": "OpenAI API",
      "url": "https://platform.openai.com",
      "pricingModel": "freemium",
      "summary": "API access to GPT and other OpenAI models for text, code, image, and audio generation.",
      "freeTier": "New accounts may receive limited trial credits; ongoing use is metered, pay-as-you-go.",
      "paidFrom": "Pay-as-you-go per-token pricing varies by model.",
      "tags": ["llm", "api", "ai"],
      "lastVerified": "2026-06-01"
    },
    {
      "name": "Google AI Studio / Gemini API",
      "url": "https://ai.google.dev",
      "pricingModel": "freemium",
      "summary": "Free and paid access to Google's Gemini models for text, vision, and multimodal tasks via API.",
      "freeTier": "Free tier with rate-limited requests per minute/day for several Gemini model variants.",
      "paidFrom": "Pay-as-you-go tier removes rate limits, billed per-token.",
      "tags": ["llm", "api", "multimodal", "google"],
      "lastVerified": "2026-06-01"
    },
    {
      "name": "Groq",
      "url": "https://groq.com",
      "pricingModel": "freemium",
      "summary": "Ultra-low-latency LLM inference API running open models (Llama, Mixtral, etc.) on custom LPU hardware.",
      "freeTier": "Free developer tier with generous rate limits for popular open models.",
      "paidFrom": "Pay-as-you-go pricing for higher throughput.",
      "tags": ["llm", "api", "inference", "open-models"],
      "lastVerified": "2026-06-01"
    },
    {
      "name": "Hugging Face",
      "url": "https://huggingface.co",
      "pricingModel": "freemium",
      "summary": "Hub for open-source models, datasets, and Spaces (hosted demos), plus Inference API and AutoTrain.",
      "freeTier": "Unlimited public model/dataset hosting, free CPU Spaces, free-tier Inference API rate limits.",
      "paidFrom": "PRO plan from $9/month; dedicated Inference Endpoints billed hourly.",
      "tags": ["llm", "open-source", "model-hub", "inference"],
      "lastVerified": "2026-06-01"
    },
    {
      "name": "OpenRouter",
      "url": "https://openrouter.ai",
      "pricingModel": "freemium",
      "summary": "Unified API gateway routing requests across dozens of LLM providers, with several free model endpoints.",
      "freeTier": "Several models offered completely free with rate limits; pay-as-you-go for premium models.",
      "tags": ["llm", "api", "gateway", "model-routing"],
      "lastVerified": "2026-06-01"
    },
    {
      "name": "Google Colab",
      "url": "https://colab.research.google.com",
      "pricingModel": "freemium",
      "summary": "Free hosted Jupyter notebooks with GPU/TPU access, popular for ML experimentation and education.",
      "freeTier": "Free tier with rotating GPU access (subject to availability and usage limits).",
      "paidFrom": "Colab Pro from ~$9.99/month for more compute and priority GPUs.",
      "tags": ["notebooks", "gpu", "jupyter", "ml"],
      "lastVerified": "2026-05-01"
    },
    {
      "name": "Kaggle Notebooks",
      "url": "https://www.kaggle.com",
      "pricingModel": "free",
      "summary": "Free GPU/TPU-enabled notebooks plus datasets and ML competitions, run by Google.",
      "freeTier": "30 GPU hours/week free, 20GB disk, free TPU quota.",
      "tags": ["notebooks", "gpu", "datasets", "competitions"],
      "lastVerified": "2026-05-01"
    },
    {
      "name": "Weights & Biases",
      "url": "https://wandb.ai",
      "pricingModel": "freemium",
      "summary": "Experiment tracking, model registry, and collaboration platform for ML teams.",
      "freeTier": "Free for personal/academic use with limited tracked hours and storage.",
      "paidFrom": "Pro plan billed per seat.",
      "tags": ["mlops", "experiment-tracking", "model-registry"],
      "lastVerified": "2026-04-01"
    },
    {
      "name": "Comet ML",
      "url": "https://www.comet.com",
      "pricingModel": "freemium",
      "summary": "MLOps platform for experiment tracking, model production monitoring, and full data lineage.",
      "freeTier": "Free tier for individuals with limited tracked experiments.",
      "paidFrom": "Teams plan billed per seat.",
      "tags": ["mlops", "experiment-tracking", "monitoring"],
      "lastVerified": "2026-04-01"
    },
    {
      "name": "GitHub Copilot",
      "url": "https://github.com/features/copilot",
      "pricingModel": "freemium",
      "summary": "AI pair-programmer offering inline code completion and chat, integrated into popular IDEs.",
      "freeTier": "Free tier with limited monthly completions/chat requests; free for students and verified open-source maintainers.",
      "paidFrom": "Individual plan from $10/month.",
      "tags": ["ai-coding", "code-completion", "ide-integration"],
      "lastVerified": "2026-06-01"
    },
    {
      "name": "Codeium / Windsurf",
      "url": "https://windsurf.com",
      "pricingModel": "freemium",
      "summary": "AI coding assistant with inline completions and an agentic IDE (Windsurf), focused on low-latency suggestions.",
      "freeTier": "Free tier with unlimited inline completions and limited premium model credits.",
      "paidFrom": "Pro plan from $15/month.",
      "tags": ["ai-coding", "ide", "code-completion"],
      "lastVerified": "2026-05-01"
    },
    {
      "name": "Cursor",
      "url": "https://www.cursor.com",
      "pricingModel": "freemium",
      "summary": "AI-native code editor (VS Code fork) with deep multi-file context, chat, and agent modes.",
      "freeTier": "Free tier (Hobby) includes limited number of premium AI requests/month.",
      "paidFrom": "Pro plan from $20/month.",
      "tags": ["ai-coding", "ide", "agentic"],
      "lastVerified": "2026-06-01"
    },
    {
      "name": "v0.dev",
      "url": "https://v0.dev",
      "pricingModel": "freemium",
      "summary": "Vercel's AI tool generating copy-paste-ready React UI code using shadcn/ui and Tailwind from text prompts.",
      "freeTier": "Starting credits plus a small monthly free credit allowance.",
      "paidFrom": "Premium plan from $20/month for more generation credits.",
      "tags": ["ai-coding", "ui-generation", "react"],
      "lastVerified": "2026-05-01"
    },
    {
      "name": "Replicate",
      "url": "https://replicate.com",
      "pricingModel": "freemium",
      "summary": "Run open-source ML models (image, audio, video, LLM) via API without managing infrastructure.",
      "freeTier": "Small free credit for new accounts; ongoing usage is metered per-second of compute.",
      "tags": ["ml-inference", "api", "open-source-models"],
      "lastVerified": "2026-04-01"
    }
  ]
}
