{
  "category": "Monitoring Logging and Observability",
  "slug": "monitoring-observability",
  "description": "Application performance monitoring, error tracking, log aggregation, and uptime monitoring services.",
  "entries": [
    {
      "name": "Sentry",
      "url": "https://sentry.io",
      "pricingModel": "freemium",
      "summary": "Error tracking and performance monitoring across web, mobile, and backend stacks with rich stack-trace context.",
      "freeTier": "5,000 errors/month, 1 team member, 1 project on free Developer plan.",
      "paidFrom": "Team plan from $26/month.",
      "tags": [
        "error-tracking",
        "apm",
        "observability"
      ],
      "lastVerified": "2026-06-01"
    },
    {
      "name": "Better Stack (formerly Better Uptime / Logtail)",
      "url": "https://betterstack.com",
      "pricingModel": "freemium",
      "summary": "Combined uptime monitoring, incident management, and log management platform with on-call alerting.",
      "freeTier": "Free tier covers limited monitors, log volume, and status pages.",
      "paidFrom": "Paid plans scale with monitors/log volume.",
      "tags": [
        "uptime-monitoring",
        "logging",
        "incident-management"
      ],
      "lastVerified": "2026-05-01"
    },
    {
      "name": "UptimeRobot",
      "url": "https://uptimerobot.com",
      "pricingModel": "freemium",
      "summary": "Simple uptime monitoring with email/SMS alerts and public status pages.",
      "freeTier": "50 monitors, 5-minute check intervals free.",
      "paidFrom": "Pro plans from $7/month for 1-minute intervals.",
      "tags": [
        "uptime-monitoring",
        "alerting",
        "status-page"
      ],
      "lastVerified": "2026-05-01"
    },
    {
      "name": "Grafana Cloud",
      "url": "https://grafana.com/products/cloud",
      "pricingModel": "freemium",
      "summary": "Managed Grafana, Prometheus (metrics), Loki (logs), and Tempo (traces) for full-stack observability.",
      "freeTier": "Free tier includes 10k metrics series, 50GB logs, 50GB traces per month.",
      "paidFrom": "Pro plan billed on usage beyond free quota.",
      "tags": [
        "metrics",
        "logs",
        "traces",
        "prometheus",
        "grafana"
      ],
      "lastVerified": "2026-06-01"
    },
    {
      "name": "New Relic",
      "url": "https://newrelic.com",
      "pricingModel": "freemium",
      "summary": "Full-stack observability platform covering APM, infrastructure, logs, and browser/mobile monitoring.",
      "freeTier": "100GB data ingest/month free, one full-access user.",
      "paidFrom": "Pay-as-you-go beyond included data ingest.",
      "tags": [
        "apm",
        "infrastructure-monitoring",
        "logs"
      ],
      "lastVerified": "2026-05-01"
    },
    {
      "name": "Datadog",
      "url": "https://www.datadoghq.com",
      "pricingModel": "freemium",
      "summary": "Comprehensive monitoring platform for infrastructure, APM, logs, security, and synthetic testing.",
      "freeTier": "Free tier for up to 5 hosts with 1-day metric retention.",
      "paidFrom": "Pro plan from $15/host/month.",
      "tags": [
        "apm",
        "infrastructure-monitoring",
        "logs",
        "security"
      ],
      "lastVerified": "2026-06-01"
    },
    {
      "name": "LogRocket",
      "url": "https://logrocket.com",
      "pricingModel": "freemium",
      "summary": "Session replay combined with frontend error/performance monitoring to see exactly what users experienced.",
      "freeTier": "1,000 sessions/month free.",
      "paidFrom": "Team plan from $99/month.",
      "tags": [
        "session-replay",
        "frontend-monitoring",
        "error-tracking"
      ],
      "lastVerified": "2026-04-01"
    },
    {
      "name": "Highlight.io",
      "url": "https://www.highlight.io",
      "pricingModel": "freemium",
      "summary": "Open-source session replay, error monitoring, and logging platform, self-hostable or cloud-managed.",
      "freeTier": "Free tier with limited monthly sessions and log/error events.",
      "paidFrom": "Paid plans scale with session/event volume.",
      "tags": [
        "session-replay",
        "open-source",
        "logging"
      ],
      "lastVerified": "2026-04-01"
    },
    {
      "name": "Checkly",
      "url": "https://www.checklyhq.com",
      "pricingModel": "freemium",
      "summary": "Synthetic monitoring and API/E2E testing built on Playwright, with monitoring-as-code workflows.",
      "freeTier": "Free tier includes limited check runs/month.",
      "paidFrom": "Team plan billed on check volume.",
      "tags": [
        "synthetic-monitoring",
        "playwright",
        "api-testing"
      ],
      "lastVerified": "2026-04-01"
    },
    {
      "name": "PagerDuty",
      "url": "https://www.pagerduty.com",
      "pricingModel": "freemium",
      "summary": "Incident response and on-call alerting platform integrating with most monitoring tools.",
      "freeTier": "Free tier for up to 5 users with basic on-call scheduling.",
      "paidFrom": "Professional plan from $21/user/month.",
      "tags": [
        "incident-management",
        "on-call",
        "alerting"
      ],
      "lastVerified": "2026-04-01"
    },
    {
      "name": "OpenTelemetry",
      "url": "https://opentelemetry.io",
      "pricingModel": "open-source",
      "summary": "Vendor-neutral open-source standard and SDKs for collecting traces, metrics, and logs across services.",
      "freeTier": "Fully free and open source; pairs with any backend (Jaeger, Prometheus, Grafana, vendor platforms).",
      "tags": [
        "tracing",
        "metrics",
        "open-source",
        "standard"
      ],
      "lastVerified": "2026-05-01"
    },
    {
      "name": "Jaeger",
      "url": "https://www.jaegertracing.io",
      "pricingModel": "open-source",
      "summary": "Open-source, self-hosted distributed tracing system originally built by Uber, CNCF graduated project.",
      "freeTier": "Completely free, self-hosted.",
      "tags": [
        "tracing",
        "distributed-systems",
        "self-hosted",
        "cncf"
      ],
      "lastVerified": "2026-05-01"
    }
  ]
}