{
  "category": "API Gateways, Docs & Developer Experience",
  "slug": "api-gateways-docs",
  "description": "API gateway/management platforms, API documentation tools, and SDK/client generation utilities.",
  "entries": [
    {
      "name": "Kong",
      "url": "https://konghq.com",
      "pricingModel": "freemium",
      "summary": "API gateway and marketplace for managing public and private APIs, with a strong open-source core.",
      "freeTier": "Kong Gateway (OSS) is fully free; Konnect cloud has a free tier for small workloads.",
      "paidFrom": "Konnect plans billed on usage beyond free tier.",
      "tags": ["api-gateway", "open-source", "api-management"],
      "lastVerified": "2026-04-01"
    },
    {
      "name": "Apidog",
      "url": "https://apidog.com",
      "pricingModel": "freemium",
      "summary": "All-in-one API design, documentation, mocking, and testing tool with key authentication, rate limiting, and monetization features.",
      "freeTier": "Free plan: up to 10 projects, 1M monthly requests, 10GB egress.",
      "paidFrom": "Paid plans add team collaboration and higher quotas.",
      "tags": ["api-design", "api-docs", "mocking", "monetization"],
      "lastVerified": "2026-05-01"
    },
    {
      "name": "ReadMe",
      "url": "https://readme.com",
      "pricingModel": "freemium",
      "summary": "Beautiful, interactive API documentation hubs with built-in API explorer and changelogs.",
      "freeTier": "Free plan available for open-source projects.",
      "paidFrom": "Startup plan from $99/month.",
      "tags": ["api-docs", "developer-portal"],
      "lastVerified": "2026-03-01"
    },
    {
      "name": "Swagger / SwaggerHub",
      "url": "https://swagger.io",
      "pricingModel": "freemium",
      "summary": "OpenAPI tooling for designing, documenting, and testing REST APIs, including the widely used Swagger UI.",
      "freeTier": "Swagger Editor/UI tools fully free and open source; SwaggerHub has a free tier for individuals.",
      "paidFrom": "Team plan billed per user.",
      "tags": ["openapi", "api-docs", "open-source"],
      "lastVerified": "2026-04-01"
    },
    {
      "name": "Stoplight",
      "url": "https://stoplight.io",
      "pricingModel": "freemium",
      "summary": "API design platform with visual OpenAPI editing, mocking, and style-guide linting.",
      "freeTier": "Free tier for individuals with limited projects.",
      "paidFrom": "Professional plan billed per user.",
      "tags": ["api-design", "openapi", "mocking"],
      "lastVerified": "2026-03-01"
    },
    {
      "name": "Mintlify",
      "url": "https://mintlify.com",
      "pricingModel": "freemium",
      "summary": "Modern documentation platform with a beautiful default theme, built for developer-facing docs sites.",
      "freeTier": "Free tier for open-source/community projects.",
      "paidFrom": "Starter plan billed monthly.",
      "tags": ["documentation", "developer-docs"],
      "lastVerified": "2026-04-01"
    },
    {
      "name": "Docusaurus",
      "url": "https://docusaurus.io",
      "pricingModel": "open-source",
      "summary": "Meta's open-source static site generator purpose-built for documentation sites, with versioning and i18n support.",
      "freeTier": "Completely free, open source; deploy anywhere (e.g., GitHub Pages, Vercel, Netlify free tiers).",
      "tags": ["documentation", "static-site-generator", "open-source"],
      "lastVerified": "2026-05-01"
    },
    {
      "name": "newreleases.io",
      "url": "https://newreleases.io",
      "pricingModel": "freemium",
      "summary": "Tracks new releases across GitHub, GitLab, PyPI, npm, RubyGems, NuGet, Cargo, Docker Hub, and more, with webhook/chat alerts.",
      "freeTier": "Free tier with limited tracked projects and notification channels.",
      "paidFrom": "Premium plan billed monthly for more tracked projects.",
      "tags": ["release-tracking", "notifications", "webhooks"],
      "lastVerified": "2026-03-01"
    }
  ]
}
